{
  "schema_version": 1,
  "id": "example-colibri-architecture",
  "objective": "Explain the architecture of the Colibri inference engine based on the documentation.",
  "target_dir": "agent-orchestrator/examples/context",
  "mode": "read",
  "importance": "normal",
  "risk": "low",
  "tool_class": "inference",
  "model_profile": "colibri-glm-5.2-inference",
  "required_capabilities": ["architecture", "reasoning"],
  "context": ["brief.md"],
  "expected_artifacts": [],
  "verifiers": [],
  "dependencies": [],
  "limits": {"timeout_seconds": 300, "max_turns": 4, "max_tokens": 4000}
}
