{
  "schema_version": 1,
  "id": "fanout-join",
  "objective": "Read both immutable candidates in manifest order.",
  "target_dir": "model-execution-harness/graph-runtime/examples/harness-target",
  "mode": "read",
  "importance": "low",
  "risk": "low",
  "tool_class": "inference",
  "model_profile": "local-ministral-inference",
  "context": ["fanout/a.txt", "fanout/b.txt"],
  "dependencies": ["fanout-left", "fanout-right"],
  "limits": {"timeout_seconds": 120, "max_turns": 3, "max_tokens": 2000}
}
