{
  "schema_version": 1,
  "id": "leihmutterschaft-dialog-turn-05-mara",
  "objective": "Read the current dialogue and generate ONLY turn 5 in German. Return exactly one JSON object matching turn-output.schema.json with turn=5, speaker=Mara, and a single-line text of about 120-160 words with no literal newline, tab, quotation mark, or control character. Mara responds to Jonas and probes the distinction between commercial and altruistic models. She argues that banning profit does not remove family pressure, dependency, pregnancy risk, or hidden compensation, and asks who bears loss if the pregnancy causes lasting harm. She remains empathetic rather than absolutist. No sources, Markdown label, or meta-commentary.",
  "target_dir": "leihmutterschaft-dialog",
  "mode": "read",
  "importance": "low",
  "risk": "low",
  "tool_class": "inference",
  "required_capabilities": ["formatting"],
  "context": ["brief.md", "research.md", "dialogue.md", "turn-output.schema.json"],
  "expected_artifacts": [],
  "verifiers": [],
  "dependencies": ["leihmutterschaft-dialog-turn-04-jonas"],
  "model_profile": "local-ministral-inference",
  "output_schema": "turn-output.schema.json",
  "limits": {"timeout_seconds": 180, "max_turns": 1, "max_tokens": 700}
}
