{
  "schema_version": 1,
  "id": "gemini-free-read-canary",
  "objective": "Read brief.md and return exactly one sentence describing the orchestration boundary.",
  "target_dir": "model-execution-harness/graph-runtime/examples/context",
  "mode": "read",
  "importance": "normal",
  "risk": "low",
  "tool_class": "files_read",
  "required_capabilities": ["planning"],
  "context": ["brief.md"],
  "expected_artifacts": [],
  "verifiers": [],
  "dependencies": [],
  "model_profile": "gemini-auto-free-read",
  "limits": {"timeout_seconds": 180, "max_turns": 3, "max_tokens": 6000}
}
