{
  "schema_version": 1,
  "id": "fanout-left",
  "objective": "Produce synthetic candidate A.",
  "target_dir": "model-execution-harness/graph-runtime/examples/harness-target",
  "mode": "write",
  "importance": "low",
  "risk": "low",
  "tool_class": "files_write",
  "model_profile": "local-ministral-files",
  "expected_artifacts": ["fanout/a.txt"],
  "allowed_write_paths": ["fanout/a.txt"],
  "limits": {"timeout_seconds": 120, "max_turns": 3, "max_tokens": 2000}
}
